{
  "prompt_id": "prm_a1b2c3d4e5f6",
  "session_id": "ses_7fce271312c1824bf9",
  "tool_name": "fs__write_file",
  "args_digest": "sha256:3e2374b2fcb7c82a7f0e6b1a5d0fe5f2c8a1b2c3d4e5f6a7b8c9d0e1f2a3b4c5",
  "decision": "allow",
  "scope": "once",
  "not_before": "2026-04-18T12:01:05.000Z",
  "not_after": "2026-04-18T12:05:30.000Z",
  "nonce": "q9Zt-X8bL4rFvH2kNpR7wS",
  "handler_kid": "kid-handler-2026-04-example-ed25519"
}
